<?xml version="1.0" encoding="utf-8" ?>

<Clients xmlns:xsi="http://www.w3.org/2001/XMLSchema-instance"
    xsi:schemaLocation="http://kolenda clients.xsd"
    xmlns="http://kolenda">
    <Fiz_lico>
        <Name>Иванов Иван Иванович</Name>
        <Profession>Инжинер</Profession>
        <Address>г.Минск, ул.Гая, д.15, кв.1</Address>
        <AcctType>
            <Depo>true</Depo>
            <Credit>false</Credit>
            <Current>false</Current>
        </AcctType>
    </Fiz_lico>
    <Yur_lico>
        <Name>ООО Рога и Копыта</Name>
        <Industry>Здравоохранение</Industry>
        <Address>г.Минск, ул.Нестерова, д.1, кв.100</Address>
        <AcctType>
            <Depo>true</Depo>
            <Credit>true</Credit>
            <Current>true</Current>
        </AcctType>
    </Yur_lico>
</Clients>
